"highSchool","name","shoots","anio","mes","dia","Altura_CM","Altura_CM_DOS","PesoNuevo"
"Sacramento in Sacramento, California","Kevin Johnson","Right","1966","03","04",182.88,30.48,81
"Union County in Union County, Kentucky","Larry Johnson","Right","1954","11","28",182.88,91.44,92.25
"Skyline in Dallas, Texas","Larry Johnson","Right","1969","03","14",182.88,182.88,112.5
"Omaha South in Omaha, Nebraska","Lee Johnson","Right","1957","06","16",182.88,335.28,92.25
"Providence St. Mel in Chicago, Illinois","Linton Johnson","Right","1980","06","13",182.88,243.84,92.25
"Everett in Lansing, Michigan","Magic Johnson","Right","1959","08","14",182.88,274.32,96.75
"Crenshaw in Los Angeles, California","Marques Johnson","Right","1956","02","08",182.88,213.36,98.1
"Lindblom in Chicago, Illinois","Mickey Johnson","Right","1952","08","31",182.88,304.8,85.5
"George Washington in New York, New York","Neil Johnson","Right","1943","04","17",182.88,213.36,99
"Findlay Prep in Henderson, Nevada","Nick Johnson","Right","1992","12","22",182.88,91.44,90.9
"South Philadelphia in Philadelphia, Pennsylvania","Ollie Johnson","Right","1949","05","11",182.88,182.88,90
"Dorsey in Los Angeles, California","Omari Johnson","Right","1989","11","26",182.88,274.32,99
"Palma in Salinas, California","Orlando Johnson","Right","1989","03","11",182.88,152.4,99
"Union Center in Huntington County, Indiana","Ralph Johnson","Right","1921","12","06",152.4,335.28,76.5
"Cedar Grove in Ellenwood, Georgia","Reggie Johnson","Right","1957","06","25",182.88,274.32,92.25
"Oak Hill Academy in Mouth of Wilson, Virginia","Rich Johnson","Right","1946","12","18",182.88,213.36,94.5
"New Prague in New Prague, Minnesota","Ron Johnson","Right","1938","07","20",182.88,243.84,96.75
"Mater Dei in Santa Ana, California","Stanley Johnson","Right","1996","05","29",182.88,213.36,110.25
"Longview in Longview, Texas","Steffond Johnson","Right","1962","11","04",182.88,243.84,108
"San Gorgonio in San Bernardino, California","Steve Johnson","Right","1957","11","03",182.88,304.8,105.75
"Clairton in Clairton, Pennsylvania","Stew Johnson","Right","1944","08","19",182.88,243.84,99
"Murrah in Jackson, Mississippi","Trey Johnson","Right","1984","08","30",182.88,152.4,98.1
"Saint Francis in Mountain View, California","Tyler Johnson","Left","1992","05","07",182.88,121.92,85.5
"Franklin D. Roosevelt in Brooklyn, New York","Vinnie Johnson","Right","1956","09","01",182.88,60.96,90
"Corsicana in Corsicana, Texas","Wesley Johnson","Right","1987","07","11",182.88,213.36,96.75
"Wakefield in Raleigh, North Carolina","Darius Johnson-Odom","Left","1989","09","28",182.88,60.96,96.75
"Belle Glade in Belle Glade, Florida","Nate Johnston","Right","1966","12","18",182.88,243.84,94.5
"Chillicothe in Chillicothe, Ohio","Neil Johnston","Right","1929","02","04",182.88,243.84,94.5
"Lewiston-Porter Central in Youngstown, New York","Jim Johnstone","Right","1960","09","20",182.88,335.28,110.25
"Oak Hill Academy in Mouth of Wilson, Virginia","Nikola Jokic","Right","1995","02","19",213.36,0,112.5
"South in Canton South, Ohio","Howie Jolliff","Right","1938","07","20",182.88,213.36,98.1
"Kathleen in Lakeland, Florida","Alvin Jones","Right","1978","09","09",182.88,335.28,119.25
"Dunbar in Washington, District of Columbia","Anthony Jones","Right","1962","09","13",182.88,182.88,87.75
"Marshall in San Antonio, Texas","Askia Jones","Right","1971","12","03",182.88,152.4,90
"Northwestern in Detroit, Michigan","Bill Jones","Right","1966","03","18",182.88,213.36,78.75
"South Mecklenburg in Charlotte, North Carolina","Bobby Jones","Right","1951","12","18",182.88,274.32,94.5
"Long Beach Polytechnic in Long Beach, California","Bobby Jones","Right","1984","01","09",182.88,213.36,96.75
"Desha Central in Rohwer, Arkansas","Caldwell Jones","Right","1950","08","04",182.88,335.28,97.65
"Desha Central in Rohwer, Arkansas","Charles Jones","Right","1957","04","03",182.88,274.32,96.75
"East Kemper in Scooba, Mississippi","Charles Jones","Right","1962","01","12",182.88,243.84,96.75
"Bishop Ford in Brooklyn, New York","Charles Jones","Right","1975","07","17",182.88,91.44,81
"St. John's College in Washington, District of Columbia","Collis Jones","Right","1949","07","03",182.88,213.36,91.35
"Steinert in Hamilton, New Jersey","Dahntay Jones","Right","1980","12","27",182.88,182.88,101.25
"Scotlandville Magnet in Baton Rouge, Louisiana","Damian Jones","Right","1995","06","30",213.36,0,110.25
"Ball in Galveston, Texas","Damon Jones","Right","1976","08","25",182.88,91.44,83.25
"Wheeler in Marietta, Georgia","DeQuan Jones","Right","1990","06","20",182.88,243.84,99.45
"Archbishop Carroll in Radnor, Pennsylvania","Derrick Jones Jr.","Left","1997","02","15",182.88,213.36,90
"Lake Wales in Lake Wales, Florida","Dominique Jones","Right","1988","10","15",182.88,121.92,96.75
"Stratford in Nashville, Tennessee","Dontae' Jones","Right","1975","06","02",182.88,243.84,99
"American Christian School in Aston, Pennsylvania","Dwayne Jones","Right","1983","06","09",182.88,335.28,112.5
"Wheatley in Houston, Texas","Dwight Jones","Right","1952","02","27",182.88,304.8,94.5
"Spingarn in Washington, District of Columbia","Earl Jones","Right","1961","01","13",213.36,0,94.5
"Ely in Pompano Beach, Florida","Eddie Jones","Right","1971","10","20",182.88,182.88,85.5
"Barringer in Newark, New Jersey","Edgar Jones","Right","1956","06","17",182.88,304.8,101.25
"Barlow in Gresham, Oregon","Fred Jones","Right","1979","03","11",182.88,121.92,94.5
"Bishop Turner in Buffalo, New York","Hutch Jones","Right","1959","09","01",182.88,243.84,85.5
"Oak Hill Academy in Mouth of Wilson, Virginia","Jake Jones","Right","1949","05","09",182.88,91.44,81
"Kimball in Dallas, Texas","Jalen Jones","Right","1993","05","27",182.88,213.36,99
"American in Miami, Florida","James Jones","Right","1980","10","04",182.88,243.84,98.1
"Melrose HS in Nashville, Tennessee","Jemerrio Jones","Right","1995","04","09",182.88,152.4,78.3
"McCall in Tallulah, Louisiana","Jimmy Jones","Right","1945","01","01",182.88,121.92,84.6
"DeMatha Catholic in Hyattsville, Maryland","Johnny Jones","Right","1943","03","12",182.88,213.36,92.25
"Mitchell-Baker in Camilla, Georgia","Jumaine Jones","Right","1979","02","10",182.88,243.84,98.1
"Commerce in San Francisco, California","K.C. Jones","Right","1932","05","25",182.88,30.48,90
"Mount Vernon in , New York","Kevin Jones","Right","1989","08","25",182.88,243.84,112.95
"East in Columbus, Ohio","Larry Jones","Right","1942","09","22",182.88,60.96,81
"Desha Central in Rohwer, Arkansas","Major Jones","Right","1953","07","09",182.88,274.32,101.25
"East in Rochester, New York","Mark Jones","Right","1961","04","10",182.88,30.48,78.75
"Milwaukee Trade and Technical in Milwaukee, Wisconsin","Mark Jones","Right","1975","05","25",182.88,182.88,96.75
"John Marshall in Portland, Oregon","Nick Jones","Right","1945","03","28",182.88,60.96,85.5
"Long Beach Polytechnic in Long Beach, California","Ozell Jones","Right","1960","11","20",182.88,335.28,105.75
"Duncanville in Duncanville, Texas","Perry Jones","Right","1991","09","24",182.88,335.28,105.75
"Dresden in Dresden, Tennessee","Popeye Jones","Right","1970","06","17",182.88,243.84,112.5
"Lester in Memphis, Tennessee","Rich Jones","Right","1946","12","27",182.88,182.88,99
"Oak Hill Academy in Mouth of Wilson, Virginia","Robin Jones","Right","1954","02","02",182.88,274.32,101.25
"Laurinburg Institute in Laurinburg, North Carolina","Sam Jones","Right","1933","06","24",182.88,121.92,89.1
"Amityville Memorial in Amityville, New York","Shelton Jones","Right","1966","04","06",182.88,274.32,94.5
"Mount Dora in Mount Dora, Florida","Solomon Jones","Right","1984","07","16",182.88,304.8,103.5
"Franklin in Portland, Oregon","Steve Jones","Right","1942","10","17",182.88,152.4,92.25
"Jefferson in Portland, Oregon","Terrence Jones","Left","1992","01","09",182.88,274.32,113.4
"Apple Valley in Apple Valley, Minnesota","Tyus Jones","Right","1996","05","10",182.88,60.96,88.2
"Harlan in Harlan, Kentucky","Wah Wah Jones","Right","1926","07","14",182.88,121.92,101.25
"Overbrook in Philadelphia, Pennsylvania","Wali Jones","Right","1942","02","14",182.88,60.96,81
"Oak Hill Academy in Mouth of Wilson, Virginia","Wil Jones","Right","1947","02","27",182.88,243.84,92.25
"Oak Hill Academy in Mouth of Wilson, Virginia","Willie Jones","Right","1936","06","29",182.88,91.44,83.25
"Cleveland in Los Angeles, California","Adonis Jordan","Right","1970","08","21",152.4,335.28,76.5
"Shortridge in Indianapolis, Indiana","Charles Jordan","Right","1954","01","31",182.88,243.84,99
"Christian Life Center Academy in Humble, Texas","DeAndre Jordan","Left","1988","07","21",182.88,335.28,119.25
"Archbishop Carroll in Washington, District of Columbia","Eddie Jordan","Right","1955","01","29",182.88,30.48,76.5
"Florida Air Academy in Melbourne, Florida","Jerome Jordan","Right","1986","09","29",213.36,0,113.85
"Emsley A. Laney in Wilmington, North Carolina","Michael Jordan","Right","1963","02","17",182.88,182.88,87.75
"Proviso East in Maywood, Illinois","Reggie Jordan","Left","1968","01","26",182.88,121.92,87.75
"Lake Clifton in Baltimore, Maryland","Thomas Jordan","Right","1968","05","23",182.88,304.8,99
"Northrop in Fort Wayne, Indiana","Walter Jordan","Right","1956","02","19",182.88,213.36,89.1
"Oak Hill Academy in Mouth of Wilson, Virginia","Phil Jordon","Right","1933","09","12",182.88,304.8,92.25
"Oak Hill Academy in Mouth of Wilson, Virginia","Johnny Jorgensen","Right","1921","12","28",182.88,60.96,83.25
"Oak Hill Academy in Mouth of Wilson, Virginia","Noble Jorgensen","Right","1925","05","18",182.88,274.32,102.6
"Oak Hill Academy in Mouth of Wilson, Virginia","Roger Jorgensen","Right","1920","09","02",182.88,152.4,90
"Findlay College Prep in Henderson, Nevada","Cory Joseph","Right","1991","08","20",182.88,91.44,86.85
"Saint Mary's in Roseau, Dominica","Garth Joseph","Right","1973","08","08",213.36,60.96,141.75
"Archbishop Carroll in Montreal, Canada","Kris Joseph","Right","1988","12","17",182.88,213.36,94.5
"Notre Dame in Port-au-Prince, Haiti","Yvon Joseph","Right","1957","10","31",182.88,335.28,110.25
"Archbishop Molloy in Jamaica, New York","Kevin Joyce","Right","1951","06","27",182.88,91.44,85.5
"New Castle in New Castle, Indiana","Butch Joyner","Right","1945","04","26",182.88,152.4,90
"Highland in Salt Lake City, Utah","Jeff Judkins","Right","1956","03","23",182.88,182.88,83.25
"Saint Philip in Chicago, Illinois","Whitey Kachan","Right","1925","09","15",182.88,60.96,78.75
"Xavier in New York, New York","George Kaftan","Right","1928","02","22",182.88,91.44,85.5
"Anaconda in Anaconda, Montana","Ed Kalafat","Right","1932","10","13",182.88,182.88,110.25
"Tri-Unity Christian in Wyoming, Michigan","Chris Kaman","Right","1982","04","28",213.36,0,119.25
"Benet Academy in Lisle, Illinois","Frank Kaminsky","Right","1993","04","04",213.36,0,108.9
"Stoneridge Preparatory School in Simi Valley, California","Enes Kanter","Right","1992","05","20",182.88,335.28,112.5
"DeWitt Clinton in Bronx, New York","Ralph Kaplowitz","Right","1919","05","18",182.88,60.96,76.5
"Artesia in Lakewood, California","Jason Kapono","Right","1981","02","04",182.88,243.84,95.85
"Oak Hill Academy in Mouth of Wilson, Virginia","Tony Kappen","Right","1919","04","13",152.4,304.8,74.25
"Oak Hill Academy in Mouth of Wilson, Virginia","Sergey Karasev","Left","1993","10","26",182.88,213.36,93.6
"Homestead in Mequon, Wisconsin","Coby Karl","Right","1983","03","06",182.88,152.4,96.75
"Oak Hill Academy in Mouth of Wilson, Virginia","George Karl","Right","1951","05","12",182.88,60.96,85.5
"Oak Hill Academy in Mouth of Wilson, Virginia","Ed Kasid","Right","1923","08","13",152.4,335.28,83.25
"Oak Hill Academy in Mouth of Wilson, Virginia","Mario Kasun","Right","1980","04","05",213.36,30.48,117
"Oak Hill Academy in Mouth of Wilson, Virginia","Leo Katkaveck","Right","1923","04","17",182.88,0,83.25
"Scarsdale in Scarsdale, New York","Bob Kauffman","Right","1946","07","13",182.88,243.84,108
"Florida Air Academy in Melbourne, Florida","Sasha Kaun","Right","1985","05","08",182.88,335.28,117
"Tilden in Chicago, Illinois","Wilbert Kautz","Right","1915","09","07",182.88,0,81
"Hanover in Wilmington, North Carolina","Clarence Kea","Right","1959","02","02",182.88,182.88,98.1
"Oak Hill Academy in Mouth of Wilson, Virginia","Mike Kearns","Right","1929","06","18",182.88,60.96,80.1
"Saint Ann's Academy in New York, New York","Tommy Kearns","Right","1936","10","06",152.4,335.28,83.25
"Woodbridge in Irvine, California","Adam Keefe","Right","1970","02","22",182.88,274.32,103.5
"Lincoln in San Francisco, California","Harold Keeling","Right","1963","09","18",182.88,121.92,83.25
"Washington in Indianapolis, Indiana","Bill Keller","Right","1947","08","30",152.4,304.8,79.65
"Dixie Hollins in Saint Petersburg, Florida","Gary Keller","Left","1944","06","13",182.88,274.32,99
"Bishop Loughlin in Brooklyn, New York","Ken Keller","Right","1922","08","16",182.88,30.48,81
"Woodside in Woodside, California","Rich Kelley","Right","1953","03","23",213.36,0,105.75
"St. Joseph in Cleveland, Ohio","Clark Kellogg","Right","1961","07","02",182.88,213.36,101.25
"Oak Hill Academy in Mouth of Wilson, Virginia","Arvesta Kelly","Right","1945","11","20",182.88,60.96,78.75
"Oak Hill Academy in Mouth of Wilson, Virginia","Jerry Kelly","Right","1918","06","14",182.88,60.96,77.4
"Ravenscroft in Raleigh, North Carolina","Ryan Kelly","Right","1991","04","09",182.88,335.28,103.5
"Oak Hill Academy in Mouth of Wilson, Virginia","Tom Kelly","Right","1924","03","05",182.88,0,76.5
"Henry Ford in Detroit, Michigan","Greg Kelser","Right","1957","09","17",182.88,213.36,85.5
"Oak Hill Academy in Mouth of Wilson, Virginia","Ben Kelso","Right","1949","04","11",182.88,91.44,87.75
"Concord in Elkhart, Indiana","Shawn Kemp","Right","1969","11","26",182.88,304.8,103.5
"Saint Dominic in Oyster Bay, New York","Tim Kempton","Right","1964","01","25",182.88,304.8,110.25
"Arsenal Technical in Indianapolis, Indiana","Frank Kendrick","Right","1950","09","11",182.88,182.88,89.1
"Franklin in Franklin, Ohio","Luke Kennard","Left","1996","06","24",182.88,152.4,92.7
"Schenley in Pittsburgh, Pennsylvania","D.J. Kennedy","Left","1989","11","05",182.88,182.88,96.75
"Oak Hill Academy in Mouth of Wilson, Virginia","Goo Kennedy","Right","1949","08","23",182.88,152.4,92.25
"DeMatha Catholic in Hyattsville, Maryland","Joe Kennedy","Right","1947","01","12",182.88,182.88,94.5
"Lincoln in Philadelphia, Pennsylvania","Pickles Kennedy","Right","1938","05","17",152.4,335.28,81
"Ullman in Birmingham, Alabama","Larry Kenon","Right","1952","12","13",182.88,274.32,92.25
"Oak Hill Academy in Mouth of Wilson, Virginia","Billy Kenville","Right","1930","12","01",182.88,60.96,84.15
"Saint Pius X in Atlanta, Georgia","Jonathan Kerner","Right","1974","06","06",182.88,335.28,110.25
"Tilden in Chicago, Illinois","Red Kerr","Right","1932","07","17",182.88,274.32,103.5
"Pacific Palisades in Pacific Palisades, California","Steve Kerr","Right","1965","09","27",182.88,91.44,78.75
"De La Salle Institute in Chicago, Illinois","Jack Kerris","Right","1925","01","30",182.88,182.88,96.75
"Bluestone in Skipworth, Virginia","Jerome Kersey","Right","1962","06","26",182.88,213.36,96.75
"Oak Hill Academy in Mouth of Wilson, Virginia","Tom Kerwin","Right","1944","07","07",182.88,213.36,94.5
"Roswell in Roswell, Georgia","Alec Kessler","Right","1967","01","13",182.88,335.28,103.5
"Roman Catholic in Philadelphia, Pennsylvania","Lari Ketner","Right","1977","02","01",182.88,274.32,124.65
"Oak Hill Academy in Mouth of Wilson, Virginia","Julius Keye","Right","1946","09","05",182.88,304.8,90
"Collins in Collins, Mississippi","Randolph Keys","Right","1966","04","19",182.88,213.36,87.75
"Oak Hill Academy in Mouth of Wilson, Virginia","Viktor Khryapa","Right","1982","08","03",182.88,274.32,94.5
"Saint Joseph of Notre Dame in Alameda, California","Jason Kidd","Right","1973","03","23",182.88,121.92,92.25
"Vincent in Vincent, Alabama","Warren Kidd","Right","1970","09","09",182.88,274.32,105.75
"Saint Patrick in Elizabeth, New Jersey","Michael Kidd-Gilchrist","Right","1993","09","26",182.88,213.36,104.4
"Springfield Gardens in Springfield Gardens, New York","Irv Kiffin","Right","1951","08","08",182.88,274.32,101.25
"Oak Hill Academy in Mouth of Wilson, Virginia","Jack Kiley","Right","1929","01","05",182.88,30.48,76.5
"Oak Hill Academy in Mouth of Wilson, Virginia","Earnie Killum","Right","1948","06","11",182.88,91.44,81
"Bastrop in Bastrop, Louisiana","Carl Kilpatrick","Right","1956","05","16",182.88,304.8,103.5
"Notre Dame Prep in Fitchburg, Massachusetts","Sean Kilpatrick","Right","1990","01","06",182.88,121.92,94.5
"Belmont in Belmont, Massachusetts","Toby Kimball","Right","1942","09","07",182.88,182.88,99
"Dobbins Technical in Philadelphia, Pennsylvania","Bo Kimble","Right","1966","04","09",182.88,121.92,85.5
"St. Joseph in Cleveland, Ohio","Stan Kimbrough","Right","1966","04","24",152.4,335.28,68.85
"Perth Amboy in Perth Amboy, New Jersey","Chad Kinch","Right","1958","05","22",182.88,121.92,85.5
"Fort Hamilton in Brooklyn, New York","Albert King","Right","1959","12","17",182.88,182.88,85.5
"Fort Hamilton in Brooklyn, New York","Bernard King","Right","1956","12","04",182.88,213.36,92.25
"Hobbton in Newton Grove, North Carolina","Chris King","Right","1969","07","24",182.88,243.84,96.75
"Grove in Paris, Tennessee","Dan King","Right","1931","01","07",182.88,182.88,99
"Appling County in Baxley, Georgia","Frankie King","Right","1972","06","06",182.88,30.48,83.25
"Stonewall Jackson in Charleston, West Virginia","George King","Right","1928","08","16",182.88,0,78.75
"Brennan HS in San Antonio, Texas","George King","Right","1994","01","15",182.88,182.88,101.25
"John McDonogh in New Orleans, Louisiana","Gerard King","Right","1972","11","25",182.88,274.32,103.5
"Fort Smith in Fort Smith, Arkansas","Jim King","Right","1941","02","07",182.88,60.96,78.75
"Plano East in Plano, Texas","Jimmy King","Right","1973","08","09",182.88,152.4,94.5
"Oak Hill Academy in Mouth of Wilson, Virginia","Loyd King","Right","1949","05","29",182.88,60.96,81
"R.T. Coles in Kansas City, Kansas","Maurice King","Right","1935","03","12",182.88,60.96,87.75
"Jackson-Olin in Birmingham, Alabama","Reggie King","Right","1957","02","14",182.88,182.88,101.25
"Harry A. Burke in Omaha, Nebraska","Rich King","Right","1969","04","04",213.36,60.96,117
"Central in Louisville, Kentucky","Ron King","Right","1951","07","11",182.88,121.92,83.25
"Lawton in Lawton, Oklahoma","Stacey King","Left","1967","01","29",182.88,335.28,103.5
"East Lansing in East Lansing, Michigan","Tom King","Right","1924","03","09",182.88,0,74.25
"Jefferson in San Antonio, Texas","Bob Kinney","Right","1920","09","16",182.88,182.88,96.75
"Jefferson in Tampa, Florida","Tarence Kinsey","Right","1984","03","21",182.88,182.88,83.25
"Frunzenskaya Sport School in Saint Petersburg, Russia","Andrei Kirilenko","Right","1981","02","18",182.88,274.32,99
"Los Alamos in Los Alamos, New Mexico","Alex Kirk","Right","1991","11","14",213.36,0,110.25
"Mount Vernon in Mount Vernon, Illinois","Walt Kirk","Right","1924","09","03",182.88,91.44,77.85
"Oak Hill Academy in Mouth of Wilson, Virginia","Wilber Kirkland","Right","1948","07","26",182.88,213.36,85.5
"Chaminade in Mineola, New York","Jim Kissane","Right","1946","08","17",182.88,213.36,94.5
"Wayne in Radnor, Pennsylvania","Doug Kistler","Right","1938","03","21",182.88,274.32,94.5
"Cape Coral in Cape Coral, Florida","Curtis Kitchen","Right","1964","01","30",182.88,274.32,105.75
"James Madison in Houston, Texas","Greg Kite","Right","1961","08","05",182.88,335.28,112.5
"Saint Augustine in New Orleans, Louisiana","Kerry Kittles","Right","1974","06","12",182.88,152.4,80.55
"Oak Hill Academy in Mouth of Wilson, Virginia","Maxi Kleber","Right","1992","01","29",182.88,335.28,108
"Slater in Slater, Missouri","Joe Kleine","Right","1962","01","04",182.88,335.28,114.75
"Montrose Christian School in Rockville, Maryland","Linas Kleiza","Right","1985","01","03",182.88,243.84,110.25
"Washington in Washington, Indiana","Leo Klier","Right","1923","05","21",182.88,60.96,76.5
"South Philadelphia in Philadelphia, Pennsylvania","Herm Klotz","Right","1921","10","21",152.4,213.36,67.5
"State in Terre Haute, Indiana","Duane Klueh","Right","1926","01","06",182.88,91.44,78.75
"Oak Hill Academy in Mouth of Wilson, Virginia","Lonnie Kluttz","Right","1945","09","17",182.88,213.36,99
"Braddock in Braddock, Pennsylvania","Billy Knight","Right","1952","06","09",182.88,182.88,87.75
"Weaver in Hartford, Connecticut","Bob Knight","Right","1929","04","30",182.88,60.96,83.25
"Seton Hall Preparatory School in West Orange, New Jersey","Brandin Knight","Right","1981","12","16",182.88,0,81
"Pine Crest School in Fort Lauderdale, Florida","Brandon Knight","Right","1991","12","02",182.88,91.44,87.75
"Seton Hall Preparatory School in West Orange, New Jersey","Brevin Knight","Right","1975","11","08",152.4,304.8,77.85
"Saint Martin De Porres in Detroit, Michigan","Negele Knight","Right","1967","03","06",182.88,30.48,78.75
"Compton in Compton, California","Ron Knight","Right","1947","08","04",182.88,213.36,96.75
"Port Jefferson in Port Jefferson, New York","Toby Knight","Left","1955","05","03",182.88,274.32,94.5
"Alta in Sandy, Utah","Travis Knight","Right","1974","09","13",213.36,0,105.75
"Oak Hill Academy in Mouth of Wilson, Virginia","Lee Knorek","Right","1921","07","15",182.88,213.36,96.75
"Wamego in Wamego, Kansas","Dick Knostman","Right","1931","08","09",182.88,182.88,96.75
"Oak Hill Academy in Mouth of Wilson, Virginia","Rod Knowles","Right","1946","02","27",182.88,274.32,96.75
"Tampa Catholic in Tampa, Florida","Kevin Knox","Right","1999","08","11",182.88,274.32,96.75
"Westside in Omaha, Nebraska","Bart Kofoed","Right","1964","03","24",182.88,121.92,94.5
"Notre Dame in Milwaukee, Wisconsin","Don Kojis","Right","1939","01","15",182.88,152.4,96.75
"Lew Wallace in Gary, Indiana","Milo Komenich","Right","1920","06","22",182.88,213.36,95.4
"Woodward in Toledo, Ohio","Howard Komives","Left","1941","05","09",182.88,30.48,83.25
"Center in Kansas City, Missouri","Jon Koncak","Right","1963","05","17",213.36,0,112.5
"Riverside-Brookfield in Riverside, Illinois","Tom Kondla","Right","1946","11","30",182.88,243.84,101.25
"Rocky in Rocky, Oklahoma","Bud Koper","Right","1942","08","09",182.88,182.88,94.5
"Fitzgerald in Warren, Michigan","Joe Kopicki","Right","1960","06","12",182.88,274.32,108
"Oak Hill Academy in Mouth of Wilson, Virginia","Furkan Korkmaz","Right","1997","07","24",182.88,213.36,85.5
"Catholic in Lexington, Kentucky","Frank Kornet","Right","1967","01","27",182.88,274.32,101.25
"Liberty Christian in Argyle, Texas","Luke Kornet","Right","1995","07","15",213.36,30.48,112.5
"Oak Hill Academy in Mouth of Wilson, Virginia","Yaroslav Korolev","Right","1987","05","07",182.88,274.32,91.35
"Pella in Pella, Iowa","Kyle Korver","Right","1981","03","17",182.88,213.36,95.4
"Oak Hill Academy in Mouth of Wilson, Virginia","Tony Koski","Right","1946","06","26",182.88,243.84,96.75
"Maple Heights in Cleveland, Ohio","Len Kosmalski","Right","1951","11","29",213.36,0,110.25
"Bloomfield in Bloomfield, New Jersey","Andy Kostecka","Right","1921","02","10",182.88,91.44,91.35
"Oak Hill Academy in Mouth of Wilson, Virginia","Harold Kottman","Right","1922","08","22",182.88,243.84,99
"GlenOak in Canton, Ohio","Kosta Koufos","Right","1989","02","24",213.36,0,110.25
"Central in Traverse City, Michigan","Tom Kozelko","Right","1951","07","01",182.88,243.84,99
"Palatine Township in Palatine, Illinois","Ronald Kozlicki","Right","1944","12","12",182.88,213.36,96.75
"Fulda in Fulda, Minnesota","Arvid Kramer","Right","1956","10","02",182.88,274.32,99
"Linton in Schenectady, New York","Barry Kramer","Right","1942","11","10",182.88,121.92,90
"Patrick Henry in San Diego, California","Joel Kramer","Right","1955","11","30",182.88,213.36,91.35
"Sandy in Sandy, Utah","Steven Kramer","Right","1945","01","01",182.88,152.4,90
"DeWitt Clinton in Bronx, New York","Dan Kraus","Right","1923","02","13",182.88,0,87.75
"Weequahic in Newark, New Jersey","Herb Krautblatt","Left","1926","11","19",182.88,30.48,85.5
"Oak Hill Academy in Mouth of Wilson, Virginia","Viacheslav Kravtsov","Right","1987","08","25",213.36,0,117
"Webster Groves in Webster Groves, Missouri","Jim Krebs","Right","1935","09","08",182.88,243.84,103.5
"Neenah in Neenah, Wisconsin","Wayne Kreklow","Right","1957","01","04",182.88,121.92,78.75
"Tell City in Tell City, Indiana","Tommy Kron","Right","1943","02","28",182.88,152.4,90
"Aurora in Aurora, Nebraska","Tom Kropp","Right","1953","02","12",182.88,91.44,92.25
"Oak Hill Academy in Mouth of Wilson, Virginia","Nenad Krstic","Right","1983","07","25",213.36,0,108
"Big Sky in Missoula, Montana","Larry Krystkowiak","Right","1964","09","23",182.88,274.32,99
"Moline in Moline, Illinois","Steve Kuberski","Right","1947","11","06",182.88,243.84,96.75
"Oak Hill Academy in Mouth of Wilson, Virginia","Leo Kubiak","Right","1927","12","25",152.4,335.28,72
"Central in Bristol, Connecticut","Bruce Kuczenski","Right","1961","02","03",182.88,304.8,103.5
"Lowell in San Francisco, California","Frank Kudelka","Right","1925","06","25",182.88,60.96,86.85
"Benedictine in Richmond, Virginia","John Kuester","Right","1955","02","06",182.88,60.96,81
"Havre in Havre, Montana","Ray Kuka","Right","1922","02","17",182.88,91.44,90
"Oak Hill Academy in Mouth of Wilson, Virginia","Toni Kukoc","Left","1968","09","18",182.88,304.8,86.4
"Wahlert in Dubuque, Iowa","Kevin Kunnert","Right","1951","11","11",213.36,0,103.5
"Duluth Central in Duluth, Minnesota","Terry Kunze","Right","1943","03","11",182.88,121.92,94.5
"Brentwood in Brentwood, New York","Mitch Kupchak","Right","1954","05","24",182.88,274.32,103.5
"Community in Oak Lawn, Illinois","C.J. Kupec","Right","1953","01","16",182.88,182.88,99
"Oak Hill Academy in Mouth of Wilson, Virginia","Rodions Kurucs","Right","1998","02","05",182.88,274.32,94.5
