"highSchool","name","shoots","anio","mes","dia","Altura_CM","Altura_CM_DOS","PesoNuevo"
"William Howard Taft in Woodland Hills, California","Spencer Dinwiddie","Right","1993","04","06",182.88,182.88,94.5
"Garland in Garland, Texas","Ike Diogu","Right","1983","09","11",182.88,243.84,112.5
"Oak Hill Academy in Mouth of Wilson, Virginia","DeSagana Diop","Right","1982","01","30",213.36,0,135
"Garfield in Terre Haute, Indiana","Terry Dischinger","Right","1940","11","21",182.88,213.36,85.05
"Oak Hill Academy in Mouth of Wilson, Virginia","Fred Diute","Right","1929","01","09",182.88,91.44,94.5
"Belgrade in Belgrade, Serbia","Vlade Divac","Right","1968","02","03",213.36,30.48,109.35
"Salesianum School in Wilmington, Delaware","Donte DiVincenzo","Right","1997","01","31",182.88,121.92,91.35
"Calvert in Baltimore, Maryland","Juan Dixon","Right","1978","10","09",182.88,91.44,73.8
"Oak Hill Academy in Mouth of Wilson, Virginia","Aleksandar Djordjevic","Right","1967","08","26",182.88,60.96,89.1
"East Alton-Wood River in Wood River, Illinois","Earl Dodd","Right","1924","11","01",182.88,152.4,78.75
"Central Catholic in Portland, Oregon","Michael Doleac","Right","1977","06","15",182.88,335.28,117.9
"Saunders in Yonkers, New York","Joe Dolhon","Right","1927","07","09",182.88,0,78.75
"Oak Hill Academy in Mouth of Wilson, Virginia","Bob Doll","Right","1919","08","10",182.88,152.4,87.75
"Luther Burbank in Sacramento, California","James Donaldson","Left","1957","08","16",213.36,60.96,123.75
"Oak Hill Academy in Mouth of Wilson, Virginia","Luka Doncic","Right","1999","02","28",182.88,213.36,98.1
"Clark in Hammond, Indiana","Bob Donham","Right","1926","10","11",182.88,60.96,85.5
"Saint Agnes in Rockville Centre, New York","Billy Donovan","Right","1965","05","30",152.4,335.28,76.95
"Union Hill in Union Hill, New Jersey","Harry Donovan","Right","1926","09","10",182.88,60.96,81
"Dillard in Fort Lauderdale, Florida","Keyon Dooling","Right","1980","05","08",182.88,91.44,88.2
"Archer in Atlanta, Georgia","Jacky Dorsey","Right","1954","12","18",182.88,213.36,103.5
"Laurinburg Institute in Laurinburg, North Carolina","Joey Dorsey","Right","1983","12","16",182.88,243.84,120.6
"Oak Hill Academy in Mouth of Wilson, Virginia","Ron Dorsey","Right","1948","10","10",182.88,121.92,90
"Maranatha in Los Angeles, California","Tyler Dorsey","Right","1996","02","18",182.88,152.4,82.35
"Jack Yates in Houston, Texas","Damyean Dotson","Right","1994","05","06",182.88,182.88,94.5
"St. Thomas Moore School in Oakdale, Connecticut","Quincy Douby","Right","1984","05","16",182.88,91.44,78.75
"Quincy in Quincy, Illinois","Bruce Douglas","Right","1964","04","09",182.88,91.44,87.75
"Colbert County in Leighton, Alabama","John Douglas","Right","1956","06","12",182.88,60.96,76.5
"Colbert County in Leighton, Alabama","Leon Douglas","Right","1954","08","26",182.88,304.8,103.5
"Spingarn in Washington, District of Columbia","Sherman Douglas","Right","1966","09","15",182.88,0,81
"Jonesboro in Jonesboro, Georgia","Toney Douglas","Right","1986","03","16",182.88,60.96,87.75
"Cass Technical in Detroit, Michigan","Chris Douglas-Roberts","Right","1987","01","08",182.88,213.36,90
"Saint Francis Preparatory School in Brooklyn, New York","Sonny Dove","Right","1945","08","16",182.88,213.36,89.1
"Melrose in Memphis, Tennessee","Jerry Dover","Right","1949","10","16",152.4,213.36,69.75
"Pahokee in Pahokee, Florida","Zabian Dowdell","Right","1984","09","10",182.88,91.44,85.95
"Oak Hill Academy in Mouth of Wilson, Virginia","Bill Downey","Right","1923","11","11",182.88,182.88,94.5
"Washington in Indianapolis, Indiana","Steve Downing","Right","1950","09","09",182.88,243.84,101.25
"William Cullen Bryant in Long Island City, New York","Danny Doyle","Right","1940","02","06",182.88,243.84,90
"Marshall in Chicago, Illinois","Milton Doyle","Right","1993","10","31",182.88,121.92,83.25
"Spring Valley in Columbia, South Carolina","PJ Dozier","Right","1996","10","25",182.88,182.88,92.25
"Paul Laurence Dunbar in Baltimore, Maryland","Terry Dozier","Right","1966","06","29",182.88,274.32,94.5
"Oak Hill Academy in Mouth of Wilson, Virginia","Goran Dragic","Left","1986","05","06",182.88,91.44,85.5
"Oak Hill Academy in Mouth of Wilson, Virginia","Zoran Dragic","Left","1989","06","22",182.88,152.4,90
"Kapaun Mt. Carmel in Wichita, Kansas","Greg Dreiling","Right","1962","11","07",213.36,30.48,112.5
"Valparaiso in Valparaiso, Indiana","Bryce Drew","Right","1974","09","21",182.88,60.96,83.25
"J.F. Shields in Beatrice, Alabama","John Drew","Right","1954","09","30",182.88,182.88,92.25
"Wyandotte in Kansas City, Kansas","Larry Drew","Right","1958","04","02",182.88,30.48,76.5
"Taft in Woodland Hills, California","Larry Drew II","Right","1990","03","05",182.88,60.96,81
"Sterling in Houston, Texas","Clyde Drexler","Right","1962","06","22",182.88,213.36,94.5
"Corliss in Chicago, Illinois","Nate Driggers","Right","1973","10","12",182.88,152.4,96.75
"Boston College High School in Boston, Massachusetts","Terry Driscoll","Right","1947","08","28",182.88,213.36,96.75
"Oak Hill Academy in Mouth of Wilson, Virginia","Predrag Drobnjak","Right","1975","10","27",182.88,335.28,121.5
"Grossmont in La Mesa, California","Ralph Drollinger","Left","1954","04","20",213.36,60.96,112.5
"St. Thomas More School in Oakdale, Connecticut","Andre Drummond","Right","1993","08","10",182.88,335.28,125.55
"Saint Francis Preparatory School in Brooklyn, New York","Dick Duckett","Right","1933","03","25",182.88,30.48,83.25
"Thornridge in Dolton, Illinois","Kevin Duckworth","Right","1964","04","01",213.36,0,123.75
"John Harris in Harrisburg, Pennsylvania","Charles Dudley","Right","1950","03","05",182.88,60.96,81
"Torrey Pines in Encinitas, California","Chris Dudley","Right","1965","02","22",182.88,335.28,105.75
"Horizon in San Diego, California","Jared Dudley","Right","1985","07","10",182.88,213.36,106.65
"Highland Park in Highland Park, Michigan","Terry Duerod","Right","1956","07","29",182.88,60.96,81
"Oak Hill Academy in Mouth of Wilson, Virginia","Bob Duffy","Right","1922","07","05",182.88,121.92,78.75
"John Jay in Katonah, New York","Bob Duffy","Right","1940","09","26",182.88,91.44,83.25
"Salmen in Slidell, Louisiana","Chris Duhon","Right","1982","08","31",182.88,30.48,83.25
"Deerfield in Deerfield, Illinois","Duje Dukan","Right","1991","12","04",182.88,274.32,99
"East in Rochester, New York","Walter Dukes","Right","1930","06","23",213.36,0,99
"Natchitoches Central in Natchitoches, Louisiana","Joe Dumars","Right","1963","05","24",182.88,91.44,85.5
"Sumner in Kansas City, Kansas","Rich Dumas","Right","1948","07","26",182.88,91.44,76.5
"Booker T. Washington in Tulsa, Oklahoma","Richard Dumas","Right","1969","05","19",182.88,213.36,90
"Millington in Millington, Tennessee","Tony Dumas","Right","1972","08","25",182.88,182.88,85.5
"Oak Hill Academy in Mouth of Wilson, Virginia","Andy Duncan","Right","1922","04","17",182.88,182.88,87.75
"Saint Dunstan's Episcopal in Saint Croix, U.S. Virgin Islands","Tim Duncan","Right","1976","04","25",182.88,335.28,112.5
"Nazareth Regional in Brooklyn, New York","Mike Dunleavy","Right","1954","03","21",182.88,91.44,81
"Jesuit in Portland, Oregon","Mike Dunleavy","Right","1980","09","15",182.88,274.32,103.5
"New London in New London, Connecticut","Kris Dunn","Right","1994","03","18",182.88,121.92,92.25
"Saint Patrick in Chicago, Illinois","Pat Dunn","Right","1931","03","17",182.88,60.96,76.5
"West End in Birmingham, Alabama","T.R. Dunn","Right","1955","02","01",182.88,121.92,86.4
"Biloxi in Biloxi, Mississippi","Ronald Dupree","Right","1981","01","26",182.88,213.36,94.05
"Montrose Christian School in Rockville, Maryland","Kevin Durant","Right","1988","09","29",182.88,274.32,108
"Dunbar in Washington, District of Columbia","John Duren","Right","1958","10","30",182.88,91.44,87.75
"Aliquippa in Aliquippa, Pennsylvania","Jarrett Durham","Right","1949","08","22",182.88,152.4,84.6
"Wilmer-Hutchins in Dallas, Texas","Pat Durham","Right","1967","03","10",182.88,213.36,94.5
"Provo in Provo, Utah","Devin Durrant","Right","1960","10","20",182.88,213.36,90
"Schenley in Pittsburgh, Pennsylvania","Ken Durrett","Right","1948","12","08",182.88,213.36,85.5
"Westbury in Westbury, New York","Dennis DuVal","Right","1952","03","31",182.88,91.44,78.75
"IMG Academy in Bradenton, Florida","Trevon Duval","Right","1998","08","03",182.88,60.96,85.05
"Loyola Academy in Wilmette, Illinois","Jack Dwan","Right","1921","05","03",182.88,121.92,90
"Lakewood in Lakewood, California","Craig Dykema","Right","1959","06","11",182.88,243.84,85.5
"Saint Patrick in Chicago, Illinois","Gene Dyker","Right","1930","02","17",182.88,182.88,101.25
"Proctor Academy in Andover, New Hampshire","Jerome Dyson","Right","1987","05","01",182.88,91.44,81
"Broadmoor in Baton Rouge, Louisiana","Ledell Eackles","Right","1966","11","24",182.88,152.4,99
"Encina in Sacramento, California","Jim Eakins","Right","1946","05","24",182.88,335.28,96.75
"Moline in Moline, Illinois","Acie Earl","Right","1970","06","23",182.88,304.8,108
"Schurz in Chicago, Illinois","Ed Earle","Right","1927","04","28",182.88,91.44,85.5
"Mount Zion Christian Academy in Durham, North Carolina","Cleanthony Early","Right","1991","04","17",182.88,243.84,94.5
"Oak Hill Academy in Mouth of Wilson, Virginia","Penny Early","Right","1943","05","30",152.4,91.44,51.3
"Westminster in Westminster, California","Mark Eaton","Left","1957","01","24",213.36,121.92,123.75
"Ballard in Louisville, Kentucky","Jerry Eaves","Right","1959","02","08",182.88,121.92,81
"St. Thomas Moore School in Oakdale, Connecticut","Devin Ebanks","Right","1989","10","28",182.88,274.32,96.75
"Fenwick in Oak Park, Illinois","Bill Ebben","Right","1935","10","07",182.88,121.92,85.5
"Springville in Springville, Iowa","Al Eberhard","Right","1952","05","10",182.88,182.88,101.25
"Westbury Christian School in Houston, Texas","Ndudi Ebi","Right","1984","06","18",182.88,274.32,90
"Booker T. Washington in Norfolk, Virginia","Roy Ebron","Right","1951","08","31",182.88,274.32,99
"The Cannon School in Concord, North Carolina","Jarell Eddie","Right","1991","10","30",182.88,213.36,98.1
"Milwaukee Trade and Technical in Milwaukee, Wisconsin","Patrick Eddie","Right","1967","12","27",182.88,335.28,108
"Centralia in Centralia, Illinois","Dike Eddleman","Right","1922","12","27",182.88,91.44,85.05
"Bayfield in Alexandria, Virginia","Kenton Edelin","Right","1962","05","24",182.88,243.84,92.25
"Northeastern in Detroit, Michigan","Charles Edge","Right","1950","02","23",182.88,182.88,94.5
"Crispus Attucks in Indianapolis, Indiana","Bobby Edmonds","Right","1941","03","08",182.88,182.88,99
"MacArthur in San Antonio, Texas","Keith Edmonson","Right","1960","09","28",182.88,152.4,87.75
"Long Beach Polytechnic in Long Beach, California","Tyus Edney","Right","1973","02","14",152.4,304.8,68.4
"Oak Hill Academy in Mouth of Wilson, Virginia","Bill Edwards","Right","1971","09","22",182.88,243.84,96.75
"Greene Central in Snow Hill, North Carolina","Blue Edwards","Right","1965","10","31",182.88,121.92,90
"Lake Clifton in Lake Clifton, Maryland","Corsley Edwards","Right","1979","03","05",182.88,274.32,123.75
"Miami in Miami, Florida","Doug Edwards","Right","1971","01","21",182.88,213.36,99
"Julia Richman in New York, New York","Franklin Edwards","Right","1959","02","02",182.88,30.48,76.5
"Roosevelt in Seattle, Washington","James Edwards","Right","1955","11","22",213.36,0,101.25
"Marion in Marion, Indiana","Jay Edwards","Right","1969","01","03",182.88,121.92,83.25
"Hudson in Hudson, Ohio","John Edwards","Right","1981","07","31",213.36,0,123.75
"St. Joseph in Cleveland, Ohio","Kevin Edwards","Right","1965","10","30",182.88,91.44,85.5
"Mountain Pointe in Phoenix, Arizona","Shane Edwards","Right","1987","05","31",182.88,213.36,99
"Middletown HS in Middletown, Ohio","Vince Edwards","Right","1996","04","05",182.88,243.84,101.25
"Weaver in Hartford, Connecticut","Johnny Egan","Right","1939","01","31",152.4,335.28,81
"Oak Hill Academy in Mouth of Wilson, Virginia","Lonnie Eggleston","Right","1918","06","08",182.88,0,76.5
"South Bend Central in South Bend, Indiana","Bulbs Ehlers","Right","1923","03","10",182.88,91.44,89.1
"Monterey in Lubbock, Texas","Craig Ehlo","Right","1961","08","11",182.88,182.88,81
"Hancock in St. Louis, Missouri","Rich Eichhorst","Right","1933","10","21",182.88,91.44,90
"Southwestern in Detroit, Michigan","Howard Eisley","Right","1972","12","04",182.88,60.96,79.65
"Worcester Academy in Worcester, Massachusetts","Obinna Ekezie","Right","1975","08","22",182.88,274.32,121.5
"North Community in Minneapolis, Minnesota","Khalid El-Amin","Right","1979","04","25",152.4,304.8,90
"Harding in Saint Paul, Minnesota","Don Eliason","Right","1918","07","24",182.88,60.96,94.5
"Power Memorial in New York, New York","Mario Elie","Right","1963","11","26",182.88,152.4,94.5
"Oak Hill Academy in Mouth of Wilson, Virginia","Ray Ellefson","Right","1922","11","18",182.88,243.84,103.5
"Rice Lake in Rice Lake, Wisconsin","Henry Ellenson","Right","1997","01","13",182.88,335.28,110.25
"The Episcopal Academy in Newtown Square, Pennsylvania","Wayne Ellington","Right","1987","11","29",182.88,152.4,90
"Pioneer in Ann Arbor, Michigan","Bob Elliott","Right","1955","08","18",182.88,274.32,101.25
"Cholla in Tucson, Arizona","Sean Elliott","Right","1968","02","02",182.88,243.84,92.25
"Parker in Chicago, Illinois","Bo Ellis","Right","1954","08","08",182.88,274.32,88.65
"Hamilton in Hamilton, Ohio","Boo Ellis","Right","1936","02","11",182.88,152.4,83.25
"Marietta in Marietta, Georgia","Dale Ellis","Right","1960","08","06",182.88,213.36,92.25
"Frederick Douglass in Atlanta, Georgia","Harold Ellis","Right","1970","10","07",182.88,152.4,90
"McClymonds in Oakland, California","Joe Ellis","Right","1944","05","03",182.88,182.88,78.75
"Lincoln in East St. Louis, Illinois","LaPhonso Ellis","Right","1970","05","05",182.88,243.84,108
"Mater Dei in Santa Ana, California","LeRon Ellis","Right","1969","04","28",182.88,274.32,101.25
"Thomas Jefferson in Brooklyn, New York","Leroy Ellis","Right","1940","03","10",182.88,304.8,94.5
"Lanier in Jackson, Mississippi","Monta Ellis","Right","1985","10","26",182.88,91.44,83.25
"Savannah in Savannah, Georgia","Pervis Ellison","Right","1967","04","03",182.88,274.32,94.5
"Power Memorial in New York, New York","Len Elmore","Right","1952","03","28",182.88,274.32,99
"Maria Regina M.A.V.O. in Rotterdam, Netherlands","Francisco Elson","Right","1976","02","28",213.36,0,105.75
"Tipton in Tipton, Indiana","Darrell Elston","Right","1952","08","15",182.88,121.92,85.5
"Thornton Township in Harvey, Illinois","Melvin Ely","Right","1978","05","02",182.88,304.8,117
"The Rock School in Gainesville, Florida","Joel Embiid","Right","1994","03","16",213.36,0,112.5
"Tecumseh in New Carlisle, Ohio","Wayne Embry","Right","1937","03","26",182.88,243.84,108
"David W. Carter in Dallas, Texas","Andre Emmett","Right","1982","08","27",182.88,152.4,103.5
"Oak Hill Academy in Mouth of Wilson, Virginia","Ned Endress","Right","1918","03","02",182.88,60.96,90
"Stillwater in Stillwater, Minnesota","Chris Engler","Right","1959","03","01",182.88,335.28,110.25
"Don Bosco Technical Institute in Rosemead, California","Wayne Englestad","Right","1966","12","06",182.88,243.84,110.25
"Howard Career Center in Wilmington, Delaware","A.J. English","Right","1967","07","11",182.88,91.44,78.75
"Dreher in Columbia, South Carolina","Alex English","Right","1954","01","05",182.88,213.36,85.5
"Oak Hill Academy in Mouth of Wilson, Virginia","Claude English","Right","1946","12","26",182.88,121.92,83.25
"Lower Richland in Columbia, South Carolina","Jo Jo English","Right","1970","02","04",182.88,121.92,87.75
"Notre Dame Preparatory School in Fitchburg, Massachusetts","Kim English","Right","1988","09","24",182.88,182.88,90
"Oak Hill Academy in Mouth of Wilson, Virginia","Scott English","Right","1950","10","20",182.88,182.88,92.25
"Rhinelander in Rhinelander, Wisconsin","Gene Englund","Right","1917","10","21",182.88,152.4,92.25
"Ventura in Ventura, California","James Ennis","Right","1990","07","01",182.88,213.36,94.5
"Saint Benedict's Preparatory School in Newark, New Jersey","Tyler Ennis","Right","1994","08","24",182.88,91.44,87.3
"George Wythe in Richmond, Virginia","Ray Epps","Right","1956","08","20",182.88,182.88,87.75
"Oak Hill Academy in Mouth of Wilson, Virginia","Semih Erden","Right","1986","07","28",213.36,0,108
"Automotive in Brooklyn, New York","Bo Erias","Right","1932","07","30",182.88,91.44,99
"El Segundo in El Segundo, California","Keith Erickson","Right","1944","04","19",182.88,152.4,87.75
"Roosevelt in Roosevelt, New York","Julius Erving","Right","1950","02","22",182.88,213.36,94.5
"New Knoxville in New Knoxville, Ohio","Evan Eschmeyer","Right","1975","05","30",182.88,335.28,114.75
"Oak Hill Academy in Mouth of Wilson, Virginia","Jack Eskridge","Left","1924","01","21",182.88,152.4,90
"Oak Hill Academy in Mouth of Wilson, Virginia","Vincenzo Esposito","Right","1969","03","01",182.88,91.44,89.1
"Reynolds HS in Troutdale, Oregon","Drew Eubanks","Right","1997","02","01",182.88,304.8,110.25
"Hillhouse in New Haven, Connecticut","Billy Evans","Right","1947","03","03",182.88,0,76.5
"Oak Hill Academy in Mouth of Wilson, Virginia","Bob Evans","Right","1925","05","31",182.88,60.96,78.75
"South in Terre Haute, Indiana","Brian Evans","Left","1973","09","13",182.88,243.84,99
"Lincoln in Port Arthur, Texas","Earl Evans","Right","1955","11","11",182.88,243.84,90.9
"St. Michael the Archangel in Baton Rouge, Louisiana","Jacob Evans","Right","1997","06","18",182.88,182.88,94.5
"Justin F. Kimball in Dallas, Texas","Jawun Evans","Right","1996","07","26",182.88,0,83.25
"Crossett in Crossett, Arkansas","Jeremy Evans","Right","1987","10","24",182.88,274.32,90
"Wichita Collegiate in Wichita, Kansas","Maurice Evans","Right","1978","11","08",182.88,152.4,99
"Laurinburg Institute in Laurinburg, North Carolina","Mike Evans","Right","1955","04","19",182.88,30.48,76.5
"Woodham in Pensacola, Florida","Reggie Evans","Right","1980","05","18",182.88,243.84,110.25
"American Christian School in Aston, Pennsylvania","Tyreke Evans","Right","1989","09","19",182.88,182.88,99
"Willowridge in Houston, Texas","Daniel Ewing","Right","1983","03","26",182.88,91.44,83.25
"Cambridge Rindge & Latin in Cambridge, Massachusetts","Patrick Ewing","Right","1962","08","05",213.36,0,108
"National Christian Academy in Fort Washington, Maryland","Patrick Ewing","Right","1984","05","20",182.88,243.84,105.75
"Lake Ginninderra in Canberra, Australia","Dante Exum","Right","1995","07","13",182.88,182.88,85.5
"Oak Hill Academy in Mouth of Wilson, Virginia","Christian Eyenga","Right","1989","06","22",182.88,152.4,94.5
"Jesuit in Sacramento, California","Festus Ezeli","Right","1989","10","21",182.88,335.28,114.75
"Power Memorial in New York, New York","Johnny Ezersky","Right","1922","03","21",182.88,91.44,78.75
"Oak Hill Academy in Mouth of Wilson, Virginia","Joe Fabel","Right","1913","09","04",182.88,30.48,85.5
"San Dieguito in San Dieguito, California","John Fairchild","Right","1943","04","28",182.88,243.84,92.25
"Oak Hill Academy in Mouth of Wilson, Virginia","Phil Farbman","Right","1924","04","03",182.88,30.48,83.25
"Technology in Newark, New Jersey","Kenneth Faried","Right","1989","11","19",182.88,243.84,99
"Winslow in Winslow, Indiana","Dick Farley","Right","1932","04","13",182.88,121.92,85.5
"Taft in Woodland Hills, California","Jordan Farmar","Right","1986","11","30",182.88,60.96,81
"Flint Northwestern in Flint, Michigan","Desmon Farmer","Left","1981","10","07",182.88,152.4,99
"Houston Academy in Dothan, Alabama","Jim Farmer","Right","1964","09","23",182.88,121.92,85.5
"Richmond in Richmond, California","Mike Farmer","Right","1936","09","26",182.88,213.36,94.5
"Artesia in Lakewood, California","Tony Farmer","Right","1970","01","03",182.88,274.32,109.8
"Cleveland Heights in Cleveland Heights, Ohio","Bob Faught","Right","1921","09","02",182.88,152.4,83.25
"Oak Hill Academy in Mouth of Wilson, Virginia","Vitor Faverani","Right","1988","05","05",182.88,335.28,117
"South Atlanta in Atlanta, Georgia","Derrick Favors","Right","1991","07","15",182.88,304.8,119.25
"Ralston Valley in Arvada, Colorado","Nick Fazekas","Right","1985","06","17",182.88,335.28,105.75
"Zephyr Hills in Zephyr Hills, Florida","Dave Fedor","Right","1940","12","10",182.88,182.88,85.5
"Lowell in San Francisco, California","Bob Feerick","Right","1920","01","02",182.88,91.44,85.5
"Alpena in Alpena, Michigan","Butch Feher","Right","1954","05","19",182.88,121.92,83.25
"Lexington in Lexington, Ohio","Jamie Feick","Right","1974","07","03",182.88,274.32,114.75
"DePaul Academy in Chicago, Illinois","Ron Feiereisel","Right","1931","08","06",182.88,91.44,83.25
"Oak Hill Academy in Mouth of Wilson, Virginia","George Feigenbaum","Right","1929","07","02",182.88,30.48,83.25
"Santa Rita in Tucson, Arizona","Dave Feitl","Right","1962","06","08",182.88,335.28,105.75
"Pershing in Detroit, Michigan","Kay Felder","Left","1995","03","29",152.4,274.32,79.2
"Oak Hill Academy in Mouth of Wilson, Virginia","Cristiano Felicio","Right","1992","07","07",182.88,304.8,119.25
"Millenium in Goodyear, Arizona","Carrick Felix","Right","1990","08","17",182.88,182.88,90.45
"Inglewood in Inglewood, California","Noel Felix","Right","1981","10","04",182.88,274.32,101.25
"Metropolitan in New York, New York","Ray Felix","Right","1930","12","10",182.88,335.28,99
"Latta in Latta, South Carolina","Raymond Felton","Right","1984","06","26",182.88,30.48,92.25
"South Shore in Chicago, Illinois","Jake Fendley","Right","1929","06","12",182.88,0,81
"Port Richmond in Staten Island, New York","Warren Fenley","Right","1922","02","08",182.88,91.44,85.5
"Everett in Lansing, Michigan","Desmond Ferguson","Right","1977","07","22",182.88,213.36,91.35
"Advanced Prep International in Dallas, Texas","Terrance Ferguson","Right","1998","05","17",182.88,213.36,85.5
"Oak Hill Academy in Mouth of Wilson, Virginia","Rudy Fernandez","Right","1985","04","04",182.88,182.88,83.25
"Skyline in Oakland, California","Eric Fernsten","Right","1953","11","01",182.88,304.8,92.25
"Brooklyn Technical in Brooklyn, New York","Al Ferrari","Right","1933","07","06",182.88,121.92,85.5
"Colegro Objectivo in Sao Paolo, Brazil","Rolando Ferreira","Right","1964","05","24",213.36,30.48,108
"Calvert in Towson, Maryland","Duane Ferrell","Right","1965","02","28",182.88,213.36,94.05
"Park Tudor in Indianapolis, Indiana","Yogi Ferrell","Right","1993","05","09",182.88,0,81
"Ogden in Ogden, Utah","Arnie Ferrin","Right","1925","07","29",182.88,60.96,81
"Cleveland in St. Louis, Missouri","Bob Ferry","Right","1937","05","31",182.88,243.84,103.5
"Dematha Catholic in Hyattsville, Maryland","Danny Ferry","Right","1966","10","17",182.88,304.8,103.5
"Oak Hill Academy in Mouth of Wilson, Virginia","Kyrylo Fesenko","Right","1986","12","24",213.36,30.48,129.6
"St. Mel's in Chicago, Illinois","Bobby Fields","Right","1949","10","20",182.88,91.44,78.75
"Verbum Dei in Los Angeles, California","Kenny Fields","Right","1962","02","09",182.88,152.4,99
"Los Alamitos in Los Alamitos, California","Landry Fields","Right","1988","06","27",182.88,213.36,94.5
"Oak Hill Academy in Mouth of Wilson, Virginia","Ron Filipek","Right","1944","02","05",182.88,152.4,92.25
"Oak Hill Academy in Mouth of Wilson, Virginia","Greg Fillmore","Right","1947","03","07",213.36,30.48,108
"Melrose in Memphis, Tennessee","Larry Finch","Right","1951","02","16",182.88,60.96,83.25
"Holy Family in Union City, New Jersey","Hank Finkel","Left","1942","04","20",213.36,0,108
"Proviso East in Maywood, Illinois","Michael Finley","Right","1973","03","06",182.88,213.36,96.75
"Oak Hill Academy in Mouth of Wilson, Virginia","Danny Finn","Right","1928","05","29",182.88,30.48,83.25
"I.C. Norcom in Portsmouth, Virginia","Dorian Finney-Smith","Right","1993","05","04",182.88,243.84,99
"Washington in Washington, Iowa","Matt Fish","Left","1969","11","18",182.88,335.28,105.75
"Parkview in Little Rock, Arkansas","Derek Fisher","Left","1974","08","09",182.88,30.48,90
"Oak Hill Academy in Mouth of Wilson, Virginia","Richard Fisher","Right","1948","10","27",182.88,152.4,96.75
"Westside in Macon, Georgia","Gerald Fitch","Right","1982","08","12",182.88,91.44,84.6
"Newtown in Elmhurst, New York","Bob Fitzgerald","Right","1923","03","14",182.88,152.4,85.5
"Newtown in Elmhurst, New York","Dick Fitzgerald","Right","1920","11","18",182.88,60.96,78.75
"Arcadia in Arcadia, Louisiana","Marcus Fizer","Right","1978","08","10",182.88,274.32,117.9
"Erasmus Hall in Brooklyn, New York","Jerry Fleishman","Left","1922","02","14",182.88,60.96,85.5
"Elston in Michigan City, Indiana","Al Fleming","Right","1954","04","05",182.88,213.36,96.75
"Westinghouse in Pittsburgh, Pennsylvania","Ed Fleming","Right","1933","07","25",182.88,91.44,85.05
"Mater Christi in Astoria, New York","Vern Fleming","Right","1962","02","04",182.88,152.4,83.25
"Norman Thomas in New York, New York","Luis Flores","Right","1981","04","11",182.88,60.96,90
"Berkley in Berkley, Michigan","Bruce Flowers","Right","1957","06","13",182.88,243.84,101.25
"Hunter Huss in Gastonia, North Carolina","Sleepy Floyd","Right","1960","03","06",182.88,91.44,76.5
"Niagara Falls in Niagara Falls, New York","Jonny Flynn","Right","1989","02","06",182.88,0,83.25
"Jeffersonville in Jeffersonville, Indiana","Mike Flynn","Right","1953","07","31",182.88,60.96,81
"Cooley in Detroit, Michigan","Larry Fogle","Right","1953","03","19",182.88,152.4,92.25
"Assumption in Worcester, Massachusetts","Jack Foley","Right","1939","04","19",182.88,91.44,76.5
"Jesuit Carmichael in Sacramento, California","Isaac Fontaine","Right","1975","04","16",182.88,121.92,94.5
"Oak Hill Academy in Mouth of Wilson, Virginia","Levi Fontaine","Right","1948","11","01",182.88,121.92,85.5
"Spencer-Van Etten in Spencer, New York","Jeff Foote","Right","1987","07","14",213.36,0,119.25
"Sexton in Lansing, Michigan","Bryn Forbes","Right","1993","07","23",182.88,91.44,85.5
