"highSchool","name","shoots","anio","mes","dia","Altura_CM","Altura_CM_DOS","PesoNuevo"
"Bloomfield in Bloomfield, New Jersey","Alaa Abdelnaby","Right","1968","06","24",182.88,304.8,108
"John Jay in Brooklyn, New York","Zaid Abdul-Aziz","Right","1946","04","07",182.88,274.32,105.75
"Power Memorial in New York, New York","Kareem Abdul-Jabbar","Right","1947","04","16",213.36,60.96,101.25
"Gulfport in Gulfport, Mississippi","Mahmoud Abdul-Rauf","Right","1969","03","09",182.88,30.48,72.9
"Lycee Aristide Briand in Evreux, France","Tariq Abdul-Wahad","Right","1974","11","03",182.88,182.88,100.35
"Wheeler in Marietta, Georgia","Shareef Abdur-Rahim","Right","1976","12","11",182.88,274.32,101.25
"Saint Joseph in South Bend, Indiana","Tom Abernethy","Right","1954","05","06",182.88,213.36,99
"Fairdale in Louisville, Kentucky","DESCONOCIDO","Right","1932","07","27",182.88,91.44,81
"Etna in Etna, Pennsylvania","John Abramovic","Right","1919","02","09",182.88,91.44,87.75
"Oak Hill Academy in Mouth of Wilson, Virginia","Alex Abrines","Right","1993","08","01",182.88,182.88,90
"Eisenhower in Rialto, California","Alex Acker","Right","1983","01","21",182.88,152.4,83.25
"Metropolitan in New York, New York","Don Ackerman","Right","1930","09","04",182.88,0,82.35
"Palos Verdes in Palos Verdes Estates, California","Mark Acres","Right","1962","11","15",182.88,335.28,99
"Troy in Troy, Michigan","Bud Acton","Right","1942","01","11",182.88,182.88,94.5
"Mesquite Horn in Mesquite, Texas","Quincy Acy","Right","1990","10","06",182.88,213.36,108
"Putnam City in Warr Acres, Oklahoma","Alvan Adams","Right","1954","07","19",182.88,274.32,94.5
"South Fulton in South Fulton, Georgia","Don Adams","Right","1947","11","27",182.88,182.88,94.5
"Oak Hill Academy in Mouth of Wilson, Virginia","George Adams","Right","1949","05","15",183.78,182.88,94.5
"Westchester in Los Angeles, California","Hassan Adams","Right","1984","06","20",182.88,121.92,99
"Mount St. Joseph in Baltimore, Maryland","Jaylen Adams","Right","1996","05","04",182.88,60.96,85.5
"Oak Hill Academy in Mouth of Wilson, Virginia","Jordan Adams","Right","1994","07","08",182.88,152.4,94.05
"Hartford Public in Hartford, Connecticut","Michael Adams","Right","1963","01","19",152.4,304.8,72.9
"Notre Dame Preparatory School in Fitchburg, Massachusetts","Steven Adams","Right","1993","07","20",213.36,0,119.25
"Snyder in Jersey City, New Jersey","Rafael Addison","Right","1964","07","22",182.88,213.36,96.75
"High Point Christian Academy in High Point, North Carolina","Bam Adebayo","Right","1997","07","18",182.88,304.8,114.75
"Victoria Rock Prep HS in Bradenton, Florida","Deng Adel","Right","1997","02","01",182.88,213.36,90
"Saint Pius X in Downey, California","DESCONOCIDO","Right","1946","06","16",182.88,30.48,78.75
"Brewster Academy in Wolfeboro, New Hampshire","Jeff Adrien","Right","1986","02","10",182.88,213.36,110.25
"Centennial in Compton, California","Arron Afflalo","Right","1985","10","15",182.88,152.4,94.5
"Crocket in Detroit, Michigan","Maurice Ager","Right","1984","02","09",182.88,152.4,90.9
"George Westinghouse in Chicago, Illinois","Mark Aguirre","Right","1959","12","10",182.88,182.88,104.4
"De Smet Jesuit in Creve Coeur, Missouri","Blake Ahearn","Right","1984","05","27",182.88,60.96,85.5
"Eugene in North Eugene, Oregon","Danny Ainge","Right","1959","03","17",182.88,121.92,94.5
"Maplewood-Richmond Heights in Maplewood, Missouri","Matthew Aitch","Right","1944","09","21",182.88,213.36,103.5
"Oak Hill Academy in Mouth of Wilson, Virginia","Alexis Ajinca","Right","1988","05","06",213.36,60.96,111.6
"Oak Hill Academy in Mouth of Wilson, Virginia","Henry Akin","Right","1944","07","31",183.78,182.88,101.25
"Casa Grande in Petaluma, California","Josh Akognon","Right","1986","02","10",152.4,335.28,83.25
"West Oaks Academy in Orlando, Florida","DeVaughn Akoon-Purcell","Right","1993","06","05",182.88,182.88,90
"Montverde Academy in Montverde, Florida","Solomon Alabi","Right","1988","03","21",213.36,30.48,112.95
"Brophy College Preparatory in Phoenix, Arizona","Mark Alarie","Right","1963","12","11",182.88,243.84,97.65
"Oak Hill Academy in Mouth of Wilson, Virginia","Gary Alcorn","Right","1936","10","08",182.88,274.32,101.25
"Oak Hill Academy in Mouth of Wilson, Virginia","Furkan Aldemir","Right","1991","08","09",182.88,304.8,108
"Thomas Jefferson in Bloomington, Minnesota","Cole Aldrich","Right","1988","10","31",182.88,335.28,112.5
"Seagoville in Seagoville, Texas","LaMarcus Aldridge","Right","1985","07","19",182.88,335.28,117
"Wamogo in Litchfield, Connecticut","Chuck Aleksinas","Right","1959","02","26",182.88,335.28,117
"Curie in Chicago, Illinois","Cliff Alexander","Right","1995","11","16",182.88,243.84,110.25
"Oak Hill Academy in Mouth of Wilson, Virginia","Cory Alexander","Right","1973","06","22",182.88,30.48,83.25
"Jordan in Durham, North Carolina","Courtney Alexander","Right","1977","04","27",182.88,152.4,94.5
"William M. Raines in Jacksonville, Florida","Gary Alexander","Right","1969","11","01",182.88,213.36,108
"Hargrave Military Academy in Chatham, Virginia","Joe Alexander","Right","1986","12","26",182.88,243.84,103.5
"Denby in Detroit, Michigan","Victor Alexander","Right","1969","08","31",182.88,274.32,119.25
"Chrysler in New Castle, Indiana","Steve Alford","Right","1964","11","23",182.88,60.96,94.5
"Word of God Academy in Raleigh, North Carolina","Rawle Alkins","Right","1997","10","29",182.88,152.4,101.25
"Oak Hill Academy in Mouth of Wilson, Virginia","Bill Allen","Right","1948","07","26",182.88,243.84,92.25
"Oak Hill Academy in Mouth of Wilson, Virginia","Bob Allen","Right","1946","07","17",182.88,274.32,92.25
"Providence School in Jacksonville, Florida","Grayson Allen","Right","1995","10","08",182.88,152.4,89.1
"St. Stephen's Episcopal School in Austin, Texas","Jarrett Allen","Right","1998","04","21",182.88,335.28,106.65
"Episcopal Academy in Merion Station, Pennsylvania","Jerome Allen","Right","1973","01","28",182.88,121.92,82.8
"New Hanover in Wilmington, North Carolina","Kadeem Allen","Right","1993","01","15",182.88,91.44,86.4
"Pennsbury in Fairless Hills, Pennsylvania","Lavoy Allen","Right","1989","02","04",182.88,274.32,117
"Wyandotte in Kansas City, Kansas","Lucius Allen","Right","1947","09","26",182.88,60.96,78.75
"Shawnee in Medford, New Jersey","Malik Allen","Right","1978","06","27",182.88,304.8,114.75
"Milton in Milton, Florida","Randy Allen","Right","1965","01","26",182.88,243.84,99
"Hillcrest in Dalzell, South Carolina","Ray Allen","Right","1975","07","20",182.88,152.4,92.25
"Crane Technical Preparatory in Chicago, Illinois","Tony Allen","Right","1982","01","11",182.88,121.92,95.85
"Richard Montgomery in Rockville, Maryland","Willie Allen","Right","1949","02","08",182.88,182.88,103.5
"McClymonds in Oakland, California","Odis Allison","Right","1949","10","02",182.88,182.88,87.75
"East in Salt Lake City, Utah","Lance Allred","Right","1981","02","02",182.88,335.28,112.5
"Lynwood in Lynwood, California","Darrell Allums","Right","1958","09","12",182.88,274.32,99
"McEachern in Powder Springs, Georgia","Morris Almond","Right","1985","02","02",182.88,182.88,101.25
"Hoboken in Hoboken, New Jersey","Derrick Alston","Right","1972","08","20",182.88,335.28,101.25
"Benjamin Cardozo in Bayside, New York","Rafer Alston","Right","1976","07","24",182.88,60.96,76.95
"Okota Grammar School in Isolo, Nigeria","Peter Aluma","Right","1973","04","23",182.88,304.8,117
"Saint John's in Toledo, Ohio","John Amaechi","Right","1970","11","26",182.88,304.8,121.5
"Walther Lutheran in Melrose Park, Illinois","Ashraf Amaya","Right","1971","11","23",182.88,243.84,103.5
"Norcross in Norcross, Georgia","Al-Farouq Aminu","Right","1990","09","21",182.88,274.32,99
"Monarch in Louisville, Colorado","Lou Amundson","Right","1982","12","07",182.88,274.32,99
"Monroe in Monroe, Wisconsin","Bob Anderegg","Right","1937","08","24",182.88,91.44,90
"Iola in Iola, Texas","Chris Andersen","Right","1978","07","07",182.88,304.8,110.25
"Oak Hill Academy in Mouth of Wilson, Virginia","David Andersen","Right","1980","06","23",182.88,335.28,110.25
"DeLaSalle in Minneapolis, Minnesota","Alan Anderson","Right","1982","10","16",182.88,182.88,99
"Oak Hill Academy in Mouth of Wilson, Virginia","Andrew Anderson","Right","1945","07","06",182.88,60.96,82.8
"Laurinburg Institute in Laurinburg, North Carolina","Antonio Anderson","Right","1985","06","05",182.88,182.88,96.75
"Thomas Edison in Philadelphia, Pennsylvania","Cliff Anderson","Right","1944","09","07",182.88,60.96,90
"Oak Hill Academy in Mouth of Wilson, Virginia","Dan Anderson","Right","1943","02","15",182.88,304.8,103.5
"North Torrance in Torrance, California","Dan Anderson","Right","1951","01","01",182.88,60.96,83.25
"Doss in Louisville, Kentucky","Derek Anderson","Right","1974","07","18",182.88,152.4,87.3
"Roth in Dayton, Ohio","Dwight Anderson","Right","1960","12","28",182.88,91.44,83.25
"Saint Francis DeSales in Chicago, Illinois","Eric Anderson","Right","1970","05","26",182.88,274.32,99
"Evan E. Worthing in Houston, Texas","Greg Anderson","Right","1964","06","22",182.88,304.8,103.5
"Metro in Chicago, Illinois","J.J. Anderson","Right","1960","09","23",182.88,243.84,87.75
"Junction City in Junction City, Arkansas","James Anderson","Right","1989","03","25",182.88,182.88,95.85
"Mullens in Mullens, West Virginia","Jerome Anderson","Right","1953","10","09",182.88,152.4,87.75
"Montrose Christian in Rockville, Maryland","Justin Anderson","Left","1993","11","19",182.88,182.88,103.5
"Archbishop Molloy in Jamaica, New York","Kenny Anderson","Left","1970","10","09",182.88,0,75.6
"Smith-Cotton in Sedali, Missouri","Kim Anderson","Right","1955","05","12",182.88,213.36,90
"St. Anthony's in Jersey City, New Jersey","Kyle Anderson","Right","1993","09","20",182.88,274.32,103.5
"George Washington Carver High School of Engineering and Science in Philadelphia, Pennsylvania","Michael Anderson","Right","1966","03","23",152.4,335.28,82.8
"Simeon Vocational School in Chicago, Illinois","Nick Anderson","Right","1968","01","20",182.88,182.88,92.25
"Rancho Alamitos in Garden Grove, California","Richard Anderson","Right","1960","11","19",182.88,304.8,108
"Bowen in Chicago, Illinois","Ron Anderson","Right","1958","10","15",182.88,213.36,96.75
"Oak Ridge in El Dorado Hills, California","Ryan Anderson","Right","1988","05","06",182.88,304.8,94.5
"Crim in Atlanta, Georgia","Shandon Anderson","Right","1973","12","31",182.88,182.88,93.6
"East Atlanta in Atlanta, Georgia","Willie Anderson","Right","1967","01","08",182.88,213.36,85.5
"Creighton Preparatory School in Omaha, Nebraska","Wally Anderzunas","Right","1946","01","11",182.88,213.36,99
"Oak Hill Academy in Mouth of Wilson, Virginia","Martynas Andriuskevicius","Right","1986","03","12",213.36,60.96,108
"Oak Hill Academy in Mouth of Wilson, Virginia","Don Anielak","Right","1930","11","01",182.88,213.36,85.5
"Centennial in Corono, California","Ike Anigbogu","Right","1998","10","17",182.88,304.8,112.5
"Jackson-Olin in Birmingham, Alabama","Michael Ansley","Right","1967","02","08",182.88,213.36,101.25
"Catholic Regional College in Melbourne, Australia","Chris Anstey","Right","1975","01","01",213.36,0,112.05
"Oak Hill Academy in Mouth of Wilson, Virginia","Giannis Antetokounmpo","Right","1994","12","06",182.88,335.28,108.9
"Dominican HS in Whitefish Bay, Wisconsin","Kostas Antetokounmpo","Right","1997","11","20",182.88,304.8,90
"Oak Hill Academy in Mouth of Wilson, Virginia","Thanasis Antetokounmpo","Right","1992","07","17",182.88,213.36,92.25
"Oak Hill Academy in Mouth of Wilson, Virginia","Carmelo Anthony","Right","1984","05","29",182.88,243.84,108
"Rancho in North Las Vegas, Nevada","Greg Anthony","Left","1967","11","15",182.88,0,79.2
"Dawson College in Montreal, Canada","Joel Anthony","Left","1982","08","09",182.88,274.32,110.25
"Oak Hill Academy in Mouth of Wilson, Virginia","Pero Antic","Right","1982","07","29",182.88,335.28,117
"Jefferson City in Jefferson City, Missouri","OG Anunoby","Right","1997","07","17",182.88,243.84,104.4
"Pershing in Detroit, Michigan","Keith Appling","Right","1992","02","13",182.88,30.48,83.25
"Padre Anacleto in Sao Paulo, Brazil","Rafael Araujo","Right","1980","08","12",182.88,335.28,126
"Taft in New York, New York","Stacey Arceneaux","Right","1936","02","17",182.88,121.92,94.5
"Lafayette in Ballwin, Missouri","Robert Archibald","Right","1980","03","29",182.88,335.28,112.5
"DeWitt Clinton in Bronx, New York","Tiny Archibald","Left","1948","09","02",182.88,30.48,67.5
"Neshaminy in Langhorne, Pennsylvania","Ryan Arcidiacono","Right","1994","03","26",182.88,91.44,90
"Thornton Township in Harvey, Illinois","Jim Ard","Right","1948","09","19",182.88,243.84,96.75
"Grant in Van Nuys, California","Gilbert Arenas","Right","1982","01","06",182.88,91.44,85.95
"Westchester in Los Angeles, California","Trevor Ariza","Right","1985","06","30",182.88,243.84,96.75
"La Salle College in Philadelphia, Pennsylvania","Paul Arizin","Right","1928","04","09",182.88,121.92,85.5
"Jefferson in Rochester, New York","Joe Arlauckas","Right","1965","07","20",182.88,274.32,103.5
"Brother Rice in Birmingham, Michigan","B.J. Armstrong","Right","1967","09","09",182.88,60.96,78.75
"Oak Hill Academy in Mouth of Wilson, Virginia","Bob Armstrong","Right","1933","06","17",182.88,243.84,99
"Vallejo in Vallejo, California","Brandon Armstrong","Left","1980","06","16",182.88,152.4,84.6
"Central in Fort Wayne, Indiana","Curly Armstrong","Right","1918","11","01",152.4,335.28,76.5
"Ashbrook in Gastonia, North Carolina","Darrell Armstrong","Right","1968","06","22",182.88,0,76.5
"Peekskill in Peekskill, New York","Hilton Armstrong","Right","1984","11","11",182.88,335.28,105.75
"Spring Woods in Houston, Texas","Tate Armstrong","Right","1955","10","05",182.88,91.44,78.75
"New Rochelle in New Rochelle, New York","Jesse Arnelle","Right","1933","12","30",182.88,152.4,99
"McCallum in Austin, Texas","Jay Arnette","Right","1938","12","19",182.88,60.96,78.75
"Saint Xavier in Cincinnati, Ohio","Bob Arnzen","Right","1947","11","03",182.88,152.4,92.25
"Colegio Santiago Apostol in Fajardo, Puerto Rico","Carlos Arroyo","Right","1979","07","30",182.88,60.96,90.9
"South Oak Cliff in Dallas, Texas","Darrell Arthur","Right","1988","03","25",182.88,274.32,105.75
"De La Salle in New Orleans, Louisiana","John Arthurs","Right","1947","08","15",182.88,121.92,83.25
"Notre Dame Prep in Fitchburg, Massachusetts","Jamel Artis","Right","1993","01","12",182.88,213.36,95.85
"Oak Hill Academy in Mouth of Wilson, Virginia","Omer Asik","Right","1986","07","04",213.36,0,114.75
"Frayser in Memphis, Tennessee","Vincent Askew","Right","1966","02","28",182.88,182.88,94.5
"Athens in Athens, Alabama","Keith Askins","Right","1967","12","15",182.88,213.36,88.65
"Homestead in Homestead, Pennsylvania","Don Asmonga","Right","1928","02","15",182.88,60.96,83.25
"Otterbein in Otterbein, Indiana","Dick Atha","Right","1931","09","21",182.88,60.96,85.5
"Evans in Orlando, Florida","Chucky Atkins","Right","1974","08","14",152.4,335.28,72
"Weequahic in Newark, New Jersey","Al Attles","Right","1936","11","07",182.88,0,78.75
"Horace Mann in Gary, Indiana","Chet Aubuchon","Right","1916","05","18",152.4,304.8,61.65
"John Muir in Pasadena, California","Stacey Augmon","Left","1968","08","01",182.88,243.84,92.25
"Hightower in Missouri City, Texas","D.J. Augustin","Right","1987","11","10",182.88,0,82.35
"Lincoln-Way Central in Mokena, Illinois","James Augustine","Left","1984","02","27",182.88,304.8,105.75
"Las Plumas in Oroville, California","Isaac Austin","Right","1969","08","18",182.88,304.8,114.75
"DeMatha Catholic in Hyattsville, Maryland","Johnny Austin","Right","1944","08","31",182.88,0,76.5
"Verbum Dei in Los Angeles, California","Ken Austin","Right","1961","07","15",182.88,274.32,92.25
"Malcolm X Shabazz in Newark, New Jersey","Anthony Avent","Right","1969","10","18",182.88,274.32,105.75
"Hopkinsville in Hopkinsville, Kentucky","Bird Averitt","Left","1952","07","22",182.88,30.48,76.5
"Oak Hill Academy in Mouth of Wilson, Virginia","William Avery","Right","1979","08","08",182.88,60.96,88.65
"Blackford in San Jose, California","Dennis Awtrey","Right","1948","02","22",182.88,304.8,105.75
"Oak Hill Academy in Mouth of Wilson, Virginia","Gustavo Ayon","Right","1985","04","01",182.88,304.8,112.5
"Etiwanda in Rancho Cucamonga, California","Jeff Ayres","Right","1987","04","29",182.88,274.32,108
"Hillcrest Prep Academy in Phoenix, Arizona","Deandre Ayton","Right","1998","07","23",213.36,30.48,112.5
"Victory Christian in Tulsa, Oklahoma","Kelenna Azubuike","Right","1983","12","16",182.88,152.4,99
"The Oakridge School in Arlington, Texas","Chris Babb","Right","1990","02","14",182.88,152.4,101.25
"Galena in Reno, Nevada","Luke Babbitt","Left","1989","06","20",182.88,274.32,101.25
"Kraljevo in Kraljevo, Serbia","Milos Babic","Right","1968","11","23",213.36,0,108
"St. John's Preparatory School in Brooklyn, New York","Johnny Bach","Right","1924","07","10",182.88,60.96,81
"Oak Hill Academy in Mouth of Wilson, Virginia","Dwayne Bacon","Right","1995","08","30",182.88,213.36,99.45
"Male in Louisville, Kentucky","Henry Bacon","Right","1948","07","05",182.88,91.44,92.25
"Moon in Coraopolis, Pennsylvania","Jim Baechtold","Right","1927","12","09",182.88,121.92,92.25
"Oak Hill Academy in Mouth of Wilson, Virginia","Dalibor Bagaric","Right","1980","02","07",213.36,30.48,114.75
"Warren Harding in Bridgeport, Connecticut","John Bagley","Right","1960","04","23",182.88,0,83.25
"Sierra Canyon in Chatsworth, California","Marvin Bagley III","Left","1999","03","14",182.88,335.28,105.3
"Jackson-Olin in Birmingham, Alabama","Carl Bailey","Right","1958","04","23",213.36,0,94.5
"Burgess in El Paso, Texas","Gus Bailey","Right","1951","02","18",182.88,152.4,83.25
"Xaverian in Westwood, Massachusetts","James Bailey","Right","1957","05","21",182.88,274.32,99
"Bladensburg in Bladensburg, Maryland","Thurl Bailey","Right","1961","04","07",182.88,335.28,96.75
"Loyola in Los Angeles, California","Toby Bailey","Right","1975","11","19",182.88,182.88,95.85
"Australian Institute of Sport in Canberra, Australia","Cameron Bairstow","Right","1990","12","07",182.88,274.32,112.5
"Olney in Philadelphia, Pennsylvania","Jimmie Baker","Right","1953","12","25",182.88,274.32,99
"Paul Laurence Dunbar in Dayton, Ohio","LaMark Baker","Right","1969","11","11",182.88,30.48,78.75
"Madison in Madison, Illinois","Maurice Baker","Right","1979","07","28",182.88,30.48,78.75
"Oak Hill Academy in Mouth of Wilson, Virginia","Norm Baker","Right","1923","02","17",182.88,0,81
"Scott City in Scott City, Kansas","Ron Baker","Right","1993","03","30",182.88,121.92,99
"Old Saybrook in Old Saybrook, Connecticut","Vin Baker","Right","1971","11","23",182.88,335.28,104.4
"St. Joseph in Metuchen, New Jersey","Wade Baldwin","Right","1996","03","29",182.88,121.92,90
"Laurinburg Institute in Laurinburg, North Carolina","Renaldo Balkman","Right","1984","07","14",182.88,243.84,93.6
"South in Worcester, Massachusetts","Cedric Ball","Right","1968","04","16",182.88,243.84,94.5
"Chino Hills in Chino Hills, California","Lonzo Ball","Right","1997","10","27",182.88,182.88,85.5
"Garey in Pomona, California","Greg Ballard","Right","1955","01","29",182.88,213.36,96.75
"New Castle in New Castle, Pennsylvania","Herschel Baltimore","Right","1921","06","21",182.88,121.92,87.75
"Westtown School in West Chester, Pennsylvania","Mohamed Bamba","Right","1998","05","12",213.36,0,99.45
"West Philadelphia in Philadelphia, Pennsylvania","Gene Banks","Right","1959","05","15",182.88,213.36,96.75
"Cimarron Memorial in Las Vegas, Nevada","Marcus Banks","Right","1981","11","19",182.88,60.96,90
"Oak Hill Academy in Mouth of Wilson, Virginia","Walker Banks","Right","1947","08","26",182.88,304.8,92.25
"Southwestern in Baltimore, Maryland","Ken Bannister","Right","1960","04","01",182.88,274.32,105.75
"Roman Catholic in Philadelphia, Pennsylvania","Mike Bantom","Right","1951","12","03",182.88,274.32,90
"Pruitt in Atlanta, Texas","John Barber","Right","1927","06","27",182.88,182.88,94.5
"Oak Hill Academy in Mouth of Wilson, Virginia","Leandro Barbosa","Right","1982","11","28",182.88,91.44,87.3
"Carbondale in Carbondale, Illinois","Steve Bardo","Right","1968","04","05",182.88,152.4,85.5
"Miami Christian School in Miami, Florida","J.J. Barea","Right","1984","06","26",182.88,0,83.25
"Oak Hill Academy in Mouth of Wilson, Virginia","Andrea Bargnani","Right","1985","10","26",213.36,0,110.25
"Yorktown in Yorktown, Indiana","Cliff Barker","Right","1921","01","15",182.88,60.96,83.25
"Welasco in Harlingen, Texas","Tom Barker","Right","1955","03","11",182.88,335.28,101.25
"Leeds in Leeds, Alabama","Charles Barkley","Right","1963","02","20",182.88,182.88,113.4
"Maine Central Institute in Pittsfield, Maine","Erick Barkley","Right","1978","02","21",182.88,30.48,79.65
"Berkeley in Berkeley, California","Don Barksdale","Right","1923","03","31",182.88,182.88,90
"Ames in Ames, Iowa","Harrison Barnes","Right","1992","05","30",182.88,243.84,101.25
"Oak Hill Academy in Mouth of Wilson, Virginia","Harry Barnes","Right","1945","07","25",182.88,91.44,92.25
"Stillwater in Stillwater, Oklahoma","Jim Barnes","Right","1941","04","13",182.88,243.84,94.5
"Central in Providence, Rhode Island","Marvin Barnes","Right","1952","07","27",182.88,243.84,94.5
"Del Campo in Sacramento, California","Matt Barnes","Right","1980","03","09",182.88,213.36,101.7
"Roosevelt in Gary, Indiana","Dick Barnett","Left","1936","10","02",182.88,121.92,85.5
"Ramona in Riverside, California","Jim Barnett","Right","1944","07","07",182.88,121.92,76.5
"Mervo in Baltimore, Maryland","Nathaniel Barnett","Right","1953","01","29",182.88,91.44,78.75
"Lincoln in Evansville, Indiana","John Barnhill","Right","1938","03","20",182.88,30.48,81
"Oak Hill Academy in Mouth of Wilson, Virginia","Norton Barnhill","Right","1953","07","15",182.88,121.92,92.25
"Cathedral in Indianapolis, Indiana","Leo Barnhorst","Right","1924","05","11",182.88,121.92,85.5
"Shamokin in Shamokin, Pennsylvania","John Barr","Right","1918","08","08",182.88,91.44,92.25
"Lehman in Canton, Ohio","Mike Barr","Right","1950","10","19",182.88,91.44,81
"Penn Hills in Penn Hills, Pennsylvania","Moe Barr","Right","1944","06","19",182.88,121.92,87.75
"Rice in New York, New York","Andre Barrett","Right","1982","02","21",152.4,304.8,77.4
"Wellington in Wellington, Kansas","Ernie Barrett","Right","1929","08","27",182.88,91.44,81
"Richwood in Richwood, West Virginia","Mike Barrett","Right","1943","09","05",182.88,60.96,69.75
"Clarksdale in Clarksdale, Mississippi","Earl Barron","Right","1981","08","14",213.36,0,112.5
"Xaverian in Westwood, Massachusetts","Dana Barros","Right","1967","04","13",152.4,335.28,73.35
"De La Salle Catholic in Concord, California","Brent Barry","Right","1971","12","31",182.88,182.88,83.25
"De La Salle Catholic in Concord, California","Drew Barry","Right","1973","02","17",182.88,152.4,85.95
"De La Salle Catholic in Concord, California","Jon Barry","Right","1969","07","25",182.88,121.92,87.75
"Roselle Park in Roselle Park, New Jersey","Rick Barry","Right","1944","03","28",182.88,213.36,92.25
"La Salle Academy in New York, New York","Ed Bartels","Right","1925","10","08",182.88,152.4,87.75
"Santa Barbara in Santa Barbara, California","Vic Bartolome","Right","1948","09","29",213.36,0,103.5
"Brewster Academy in Wolfeboro, New Hampshire","Will Barton","Right","1991","01","06",182.88,182.88,85.5
"Eleanor Roosevelt in Greenbelt, Maryland","Eddie Basden","Right","1983","02","15",182.88,152.4,96.75
"Thomas Edison in Philadelphia, Pennsylvania","Jerry Baskerville","Right","1951","11","10",182.88,213.36,85.5
"Capitol in Baton Rouge, Louisiana","Brandon Bass","Right","1985","04","30",182.88,243.84,112.5
"McKinley in Washington, District of Columbia","Tim Bassett","Left","1951","04","01",182.88,243.84,101.25
"H. Grady Spruce in Dallas, Texas","Maceo Baston","Right","1975","05","29",182.88,274.32,96.75
"Oak Hill Academy in Mouth of Wilson, Virginia","Mengke Bateer","Right","1975","11","20",182.88,335.28,130.5
"McAdams in Camden, Mississippi","Billy Ray Bates","Right","1956","05","31",182.88,121.92,94.5
"University HS in Normal, Illinois","Keita Bates-Diop","Right","1996","01","23",182.88,274.32,103.05
"Oak Hill Academy in Mouth of Wilson, Virginia","Esteban Batista","Left","1983","09","02",182.88,304.8,121.5
"Wilson in Long Beach, California","Mike Batiste","Right","1977","11","21",182.88,243.84,101.25
"South Oak Cliff in Dallas, Texas","Tony Battie","Right","1976","02","11",182.88,335.28,103.5
"Detroit Country Day School in Beverly Hills, Michigan","Shane Battier","Right","1978","09","09",182.88,243.84,99
"McKinley in Washington, District of Columbia","John Battle","Right","1962","11","09",182.88,60.96,78.75
"West Aurora in Aurora, Illinois","Kenny Battle","Left","1964","10","10",182.88,182.88,94.5
"Springfield (Delco) in Springfield, Pennsylvania","Dave Batton","Right","1956","03","26",182.88,304.8,108
"Thornton Township in Harvey, Illinois","Lloyd Batts","Right","1951","05","09",182.88,121.92,83.25
"Oak Hill Academy in Mouth of Wilson, Virginia","Nicolas Batum","Right","1988","12","14",182.88,243.84,90
"West Philadelphia in Philadelphia, Pennsylvania","Johnny Baum","Right","1946","06","17",182.88,152.4,90
"Midvale in Midvale, Ohio","Frankie Baumholtz","Left","1918","10","07",152.4,304.8,76.5
"Hargrave Military Academy in Chatham, Virginia","Lonny Baxter","Right","1979","01","27",182.88,243.84,117
"Saint Mary's in Phoenix, Arizona","Jerryd Bayless","Right","1988","08","20",182.88,91.44,90
"Spingarn in Washington, District of Columbia","Elgin Baylor","Right","1934","09","16",182.88,152.4,101.25
"Oak Hill Academy in Mouth of Wilson, Virginia","Howard Bayne","Right","1942","07","28",182.88,182.88,105.75
"Oak Hill Academy in Mouth of Wilson, Virginia","Aron Baynes","Right","1986","12","09",182.88,304.8,117
"Oak Hill Academy in Mouth of Wilson, Virginia","Sergei Bazarevich","Right","1965","03","16",182.88,60.96,75.6
